2018/11/22,1位に輝いた起業家は？ Forbes JAPAN「起業家ランキング2019」発表,https://news.biglobe.ne.jp/economy/1122/fbj_181122_0209218605.html,1位に輝いた起業家は？ Forbes JAPAN「起業家ランキング2019」発表&nbsp;&nbsp;BIGLOBEニュースFull coverage
2018/11/22,博多華丸が明かすコンビ不仲時代「ギクシャクしても新幹線は隣」,http://news.livedoor.com/article/detail/15634009/,博多華丸が明かすコンビ不仲時代「ギクシャクしても新幹線は隣」&nbsp;&nbsp;livedoorFull coverage
2018/11/22,博多華丸が明かしたコンビ不仲「モノマネだけと酷評されて…」,https://smart-flash.jp/entame/55302,博多華丸が明かしたコンビ不仲「モノマネだけと酷評されて…」&nbsp;&nbsp;SmartFLASHFull coverage
2018/11/21,W杯は盛り上がる日本代表 日本サッカー協会が抱えるビジネスの課題,http://ascii.jp/elem/000/001/769/1769981/,W杯は盛り上がる日本代表 日本サッカー協会が抱えるビジネスの課題&nbsp;&nbsp;ASCII.jpFull coverage
2018/11/20,人手不足で「RPA人材」の需要拡大 求人数は前年比6倍、年収3000万円の案件も,http://www.itmedia.co.jp/business/articles/1811/20/news095.html,人手不足で「RPA人材」の需要拡大 求人数は前年比6倍、年収3000万円の案件も&nbsp;&nbsp;ITmediaFull coverage
2018/11/20,RPA関連技術者へのニーズが急増、最高提示年収は3000万円――ビズリーチが調査,http://www.atmarkit.co.jp/ait/articles/1811/21/news032.html,RPA関連技術者へのニーズが急増、最高提示年収は3000万円――ビズリーチが調査&nbsp;&nbsp;@IT人手不足の深刻化に伴い「RPA」求人数が前年比6.4倍に～「RPAエンジニア」は9.1倍「RPA」の最高提示年収は3000万円～&nbsp;&nbsp;PR TIMES (プレスリリース)「RPA」関連の求人が前年比6.4倍に--最高3000万円の提示年収も&nbsp;&nbsp;ZDNet JapanFull coverage
2018/11/19,に配信されたプレスリリースです。メディア会員限定の記事となります。,https://prtimes.jp/main/html/rd/p/000000038.000034075.html,に配信されたプレスリリースです。メディア会員限定の記事となります。&nbsp;&nbsp;PR TIMES (プレスリリース)Full coverage
2018/11/16,即戦力人材と企業をつなぐ転職サイト「ビズリーチ」テレビCM第3弾、11/17（土）放送開始,https://prtimes.jp/main/html/rd/p/000000039.000034075.html,即戦力人材と企業をつなぐ転職サイト「ビズリーチ」テレビCM第3弾、11/17（土）放送開始&nbsp;&nbsp;PR TIMES (プレスリリース)Full coverage
2018/11/15,昭和女子大学がビズリーチで副業・兼業限定の理事長特命補佐を公募：ビジネスプロフェッショナルが挑む大学改革,https://prtimes.jp/main/html/rd/p/000000037.000034075.html,昭和女子大学がビズリーチで副業・兼業限定の理事長特命補佐を公募：ビジネスプロフェッショナルが挑む大学改革&nbsp;&nbsp;PR TIMES (プレスリリース)Full coverage
2018/11/13,ビズリーチがイベントで語る、BtoBマーケの成功に欠かせない3つのカギ【大阪開催・参加無料】,https://markezine.jp/article/detail/29690,ビズリーチがイベントで語る、BtoBマーケの成功に欠かせない3つのカギ【大阪開催・参加無料】&nbsp;&nbsp;MarkeZineFull coverage
2018/11/13,ビズリーチ、サービス業の承継支援,https://www.nikkei.com/article/DGKKZO37728250T11C18A1TJ2000/,ビズリーチ、サービス業の承継支援&nbsp;&nbsp;日本経済新聞Full coverage
2018/11/12,フィードフォースのフィード管理ツール「 dfplus.io 」、求人検索エンジン「スタンバイ」へのデータフィード送信に対応！,https://webtan.impress.co.jp/u/2018/11/12/31028,フィードフォースのフィード管理ツール「 dfplus.io 」、求人検索エンジン「スタンバイ」へのデータフィード送信に対応！&nbsp;&nbsp;Web担当者Forum (プレスリリース) (ブログ)Full coverage
2018/11/04,「ビズリーチ・サクシード」で新サービス「承継公募」 ゴーゴーカレーグループがカレー名店募集,https://news.nissyoku.co.jp/news/detail/?id=AOYAGI20181102073059080&cc=01&ic=160,「ビズリーチ・サクシード」で新サービス「承継公募」 ゴーゴーカレーグループがカレー名店募集&nbsp;&nbsp;食の情報源Full coverage
2018/11/02,日本フェンシング協会がビズリーチで実施した副業・兼業限定の戦略プロデューサー公募に計1127名が応募,https://prtimes.jp/main/html/rd/p/000000035.000034075.html,日本フェンシング協会がビズリーチで実施した副業・兼業限定の戦略プロデューサー公募に計1127名が応募&nbsp;&nbsp;PR TIMES (プレスリリース)４職種に１１２７人応募 専門家公募、太田会長「大変うれしく思う」／フェンシング&nbsp;&nbsp;サンケイスポーツFull coverage
2018/11/02,横浜市とビズリーチ、市内求人の専用アプリ,https://www.nikkei.com/article/DGXMZO37305380S8A101C1L82000/,横浜市とビズリーチ、市内求人の専用アプリ&nbsp;&nbsp;日本経済新聞Full coverage
2018/11/01,ビズリーチ・サクシードが事業を譲りたい経営者のための「承継公募」を開始,https://prtimes.jp/main/html/rd/p/000000034.000034075.html,ビズリーチ・サクシードが事業を譲りたい経営者のための「承継公募」を開始&nbsp;&nbsp;PR TIMES (プレスリリース)「ビズリーチ・サクシード」で承継公募サービス開始 第1号案件はゴーゴーカレーグループ&nbsp;&nbsp;食の情報源人材サービスのビズリーチ、公募で事業承継を支援&nbsp;&nbsp;日本経済新聞Full coverage
2018/11/01,池上彰、ビズリーチCM美女・吉谷彩子＆相内優香アナとスペインへ！名画「ゲルニカ」の独占取材も,https://news.merumo.ne.jp/article/genre/8020558,池上彰、ビズリーチCM美女・吉谷彩子＆相内優香アナとスペインへ！名画「ゲルニカ」の独占取材も&nbsp;&nbsp;めるもFull coverage
2018/10/30,ビズリーチ代表・南壮一郎氏と鈴木康友浜松市長が語る。地方ビジネスの可能性と、浜松でならできること,https://www.lifehacker.jp/2018/11/bizreach-hamamatsu.html,ビズリーチ代表・南壮一郎氏と鈴木康友浜松市長が語る。地方ビジネスの可能性と、浜松でならできること&nbsp;&nbsp;ライフハッカー［日本版］Full coverage
2018/10/26,埼玉県信金、事業承継支援でビズリーチと提携,https://www.nikkei.com/article/DGXMZO36985610W8A021C1L72000/,埼玉県信金、事業承継支援でビズリーチと提携&nbsp;&nbsp;日本経済新聞Full coverage
2018/10/25,未来の経営と働き方を考えるFuture of Workが「Inside Sales Conference 2018」を12月6日に開催,https://prtimes.jp/main/html/rd/p/000000032.000034075.html,未来の経営と働き方を考えるFuture of Workが「Inside Sales Conference 2018」を12月6日に開催&nbsp;&nbsp;PR TIMES (プレスリリース)【未来の経営と働き方を考えるFuture of Workが「Inside Sales Conference」を12月6日に開催】&nbsp;&nbsp;ストレートプレスFull coverage
